{
  "intent_version": "1.0", "intent_id": "intent-h2-02", "run_id": "run-h2-02", "task_ref": "bbbbbbbbbbbbbbbbbbbbbbbbbbbbbbbbbbbbbbbbbbbbbbbbbbbbbbbbbbbbbbbb", "tool_ref": {"tool_id": "local-worktree-reader", "profile_sha256": "be38e8305f123933bbab8ac3275f8c5d21ad6860e9700115bf46cd498930795e"}, "operation_id": "read-adr", "arguments": {"path": "docs/architecture-decision-records/0007-runtime-and-tool-policy-boundary.md"}, "resource_scope": {"kind": "filesystem", "path": "docs/architecture-decision-records/0007-runtime-and-tool-policy-boundary.md"}, "requested_budget": {"max_output_bytes": 64}, "requested_by": "agent", "policy_context_ref": {"policy_id": "local-read-policy", "policy_sha256": "b6cac6b2eb0ca1b4255cdc0ac9f87b23d32e52942b8371ef6302f59be25f96c1"}, "provenance": {"source": "adf_request"}
}
